{
  "schema": "harness-e2e-task-suite/v2",
  "id": "remote_rc",
  "version": 1,
  "lane": "remote_release",
  "release_channel": "rc",
  "official_verifier_required": true,
  "repetitions": 5,
  "tasks": [
    "bugfix_config_precedence",
    "bugfix_cache_invalidation",
    "feature_batch_replay",
    "security_code_review",
    "contract_migration_plan",
    "release_train_recovery",
    "release_train_recovery_simulated"
  ]
}
