{
  "schema": "harness-e2e-task-suite/v2",
  "id": "development",
  "version": 1,
  "lane": "local_development",
  "official_verifier_required": false,
  "repetitions": 5,
  "tasks": [
    "bugfix_config_precedence",
    "bugfix_cache_invalidation",
    "feature_batch_replay",
    "security_code_review",
    "contract_migration_plan",
    "release_train_recovery",
    "release_train_recovery_simulated"
  ]
}
